<?xml version="1.0" encoding="UTF-8"?>
<dataroot xmlns:od="urn:schemas-microsoft-com:officedata" xmlns:xsi="http://www.w3.org/2001/XMLSchema-instance"  xsi:noNamespaceSchemaLocation="Cast.xsd" generated="2019-05-23T09:30:47">
<Cast>
<ID>24</ID>
<Identifier>Adimarius2</Identifier>
<Location>Archives Nationales, Paris</Location>
<Accession_x002F_Collection_x0020_number>Service des Sceaux; SC/Collection Douët d&apos;Arcq 6201</Accession_x002F_Collection_x0020_number>
<Colour_x0020_1>uncoloured</Colour_x0020_1>
<Colour_x0020_2>uncoloured</Colour_x0020_2>
<Material>plaster</Material>
<Surface>varnished</Surface>
<Surround>none</Surround>
<Condition_x003A__x0020_fineness>fine</Condition_x003A__x0020_fineness>
<Condition_x003A__x0020_completeness>complete</Condition_x003A__x0020_completeness>
<Covering>none</Covering>
<Notes>L. Douët d&apos;Arcq, &apos;La Collection des Sceaux&apos;, vol. 2, p. 441, no. 6201.  Original in Arch. de l&apos;Emp. L 361.  &apos;Appendu à une bulle du cardinal en faveur de l&apos;hôpital des Haudriettes, datée de Paris, 18 des calendes de mai de l&apos;an 4 du pontificat de Jean XXIII (14 avril 1415).&apos;</Notes>
<MyImage>Allemanus1AN.jpg</MyImage>
<Height>83</Height>
<Width>58</Width>
<Figure_x0020_number>26</Figure_x0020_number>
</Cast>
<Cast>
<ID>25</ID>
<Identifier>Adimarius3</Identifier>
<Location>Archives Nationales, Paris</Location>
<Accession_x002F_Collection_x0020_number>Service des Sceaux; SC/Collection Douët d&apos;Arcq 6202</Accession_x002F_Collection_x0020_number>
<Colour_x0020_1>uncoloured</Colour_x0020_1>
<Colour_x0020_2>uncoloured</Colour_x0020_2>
<Material>plaster</Material>
<Surface>varnished</Surface>
<Surround>none</Surround>
<Condition_x003A__x0020_fineness>fine</Condition_x003A__x0020_fineness>
<Condition_x003A__x0020_completeness>damage to legend</Condition_x003A__x0020_completeness>
<Covering>none</Covering>
<Notes>Douët d&apos;Arcq, L., &apos;Collection de Sceaux&apos;, vol. 2, p. 441, no. 6202.  Original held in Arch. de l&apos;Emp. K 53, no. 18 bis.  &apos;Appendu à une bulle du cardinal, datée de Paris, 18 des calendes de mai de l&apos;an 4 du pontificat de Jean XXII (14 avril 1415), vidimant des lettres de Charles VI, datées d&apos;Orléans, avril après Pâques, qui donnent le gouvernement de l&apos;hôpital des Haudriettes au grand aumônier. - Nota.  Il est à remarquer que le cardinal scelle le même jour avec deux sceaux tout à fait différents.&apos;</Notes>
<MyImage>Allemanus2AN.jpg</MyImage>
<Height>80</Height>
<Width>56</Width>
<Figure_x0020_number>27</Figure_x0020_number>
</Cast>
<Cast>
<ID>22</ID>
<Identifier>AigrefeuilleF1</Identifier>
<Location>Archives Nationales, Paris</Location>
<Accession_x002F_Collection_x0020_number>Service des Sceaux; SC/Champagne 1449</Accession_x002F_Collection_x0020_number>
<Colour_x0020_1>uncoloured</Colour_x0020_1>
<Colour_x0020_2>uncoloured</Colour_x0020_2>
<Material>plaster</Material>
<Surface>plain</Surface>
<Surround>none</Surround>
<Condition_x003A__x0020_fineness>clear</Condition_x003A__x0020_fineness>
<Condition_x003A__x0020_completeness>damage to design and legend</Condition_x003A__x0020_completeness>
<Covering>none</Covering>
<Notes>Cast from a wax impression in the Archives de la Aube.</Notes>
<MyImage>AigrefeuilleF1AN.jpg</MyImage>
<Height>85</Height>
<Figure_x0020_number>14</Figure_x0020_number>
</Cast>
<Cast>
<ID>23</ID>
<Identifier>AlbretL1</Identifier>
<Location>Archives Nationales, Paris</Location>
<Accession_x002F_Collection_x0020_number>Service des Sceaux; SC/Collection Douët d&apos;Arcq 6209</Accession_x002F_Collection_x0020_number>
<Colour_x0020_1>uncoloured</Colour_x0020_1>
<Colour_x0020_2>uncoloured</Colour_x0020_2>
<Material>plaster</Material>
<Surface>varnished</Surface>
<Surround>none</Surround>
<Condition_x003A__x0020_fineness>clear</Condition_x003A__x0020_fineness>
<Condition_x003A__x0020_completeness>damage to legend</Condition_x003A__x0020_completeness>
<Covering>none</Covering>
<Notes>M. Douët d&apos;Arcq, &apos;La Collection des Sceaux&apos;, vol. 2, pp. 442-443, no. 6209.  Original held in Arch. de l&apos;Emp. L 368.  &apos;Même provenance que le numéro 6206&apos;.</Notes>
<MyImage>AlbretL1AN.jpg</MyImage>
<Height>95</Height>
<Width>62</Width>
<Figure_x0020_number>48</Figure_x0020_number>
</Cast>
<Cast>
<ID>27</ID>
<Identifier>Amboise1</Identifier>
<Location>Archives Nationales, Paris</Location>
<Accession_x002F_Collection_x0020_number>Service des Sceaux; SC/Normandie 2156</Accession_x002F_Collection_x0020_number>
<Colour_x0020_1>uncoloured</Colour_x0020_1>
<Colour_x0020_2>uncoloured</Colour_x0020_2>
<Material>plaster</Material>
<Surface>varnished</Surface>
<Surround>none</Surround>
<Condition_x003A__x0020_fineness>clear</Condition_x003A__x0020_fineness>
<Condition_x003A__x0020_completeness>damage to design and legend</Condition_x003A__x0020_completeness>
<Covering>none</Covering>
<Notes>Cat. no. 2156, from a detached seal in the Musee de Rouen.</Notes>
<MyImage>AmboiseG3AN.jpg</MyImage>
<Height>85</Height>
<Width>65</Width>
<Figure_x0020_number>66</Figure_x0020_number>
</Cast>
<Cast>
<ID>30</ID>
<Identifier>BarboM1</Identifier>
<Location>Archives Nationales, Paris</Location>
<Accession_x002F_Collection_x0020_number>Service des Sceaux; SC/Champagne 1457</Accession_x002F_Collection_x0020_number>
<Colour_x0020_1>uncoloured</Colour_x0020_1>
<Colour_x0020_2>uncoloured</Colour_x0020_2>
<Material>plaster</Material>
<Surface>plain</Surface>
<Surround>none</Surround>
<Condition_x003A__x0020_fineness>fine</Condition_x003A__x0020_fineness>
<Condition_x003A__x0020_completeness>complete</Condition_x003A__x0020_completeness>
<Covering>plastic cover</Covering>
<Notes>Held in the Archives Nationales, Champagne no. 1457.  &apos;Sceau en navette, de 93 et 51 mill. sur cordelettes de chanvre.  Cire vermeille dans une cuvette de cire vierge et boîte  de fer blanc.- Arch. de la Marne, G / 404, coll. Roserot nº 346 (incomplet).&apos;</Notes>
<MyImage>BarboM1AN.jpg</MyImage>
<Height>93</Height>
<Width>51</Width>
<Figure_x0020_number>51</Figure_x0020_number>
</Cast>
<Cast>
<ID>31</ID>
<Identifier>BarboM2</Identifier>
<Location>Archives Nationales, Paris</Location>
<Accession_x002F_Collection_x0020_number>Service des Sceaux; SC/Champagne 1464</Accession_x002F_Collection_x0020_number>
<Colour_x0020_1>uncoloured</Colour_x0020_1>
<Colour_x0020_2>uncoloured</Colour_x0020_2>
<Material>plaster</Material>
<Surface>plain</Surface>
<Surround>none</Surround>
<Condition_x003A__x0020_fineness>poor</Condition_x003A__x0020_fineness>
<Condition_x003A__x0020_completeness>damage to design and legend</Condition_x003A__x0020_completeness>
<Covering>plastic cover</Covering>
<Notes>Held in Archives Nationales Champagne no. 1464.</Notes>
<MyImage>BarboM2AN.jpg</MyImage>
<Width>61</Width>
<Figure_x0020_number>52</Figure_x0020_number>
</Cast>
<Cast>
<ID>32</ID>
<Identifier>BarL1</Identifier>
<Location>Archives Nationales, Paris</Location>
<Accession_x002F_Collection_x0020_number>Service des Sceaux; SC/Champagne 1451</Accession_x002F_Collection_x0020_number>
<Colour_x0020_1>uncoloured</Colour_x0020_1>
<Colour_x0020_2>uncoloured</Colour_x0020_2>
<Material>plaster</Material>
<Surface>plain</Surface>
<Surround>none</Surround>
<Condition_x003A__x0020_fineness>clear</Condition_x003A__x0020_fineness>
<Condition_x003A__x0020_completeness>damage to design and legend</Condition_x003A__x0020_completeness>
<Covering>plastic cover</Covering>
<Notes>Held in Archives Nationales Champagne no. 1451.  &apos;Cardinal-diacre de Sainte-Agathe, “administrator 		perpetuus episcopatus et ducatus Lingonensis” – 1403.
	Fragment d’un sceau en navette, de 85 et 62 mill., sur lacs de soie rouge. Cire vermeille dans une cuvette de cire vierge.- Arch. de la Haute Marne, carton réservé 2, H Val des Ecoliers.&apos;  Inventaire des Sceaux de la Champagne, 1451. Size: 85 x 62.</Notes>
<MyImage>BarL1AN.jpg</MyImage>
<Figure_x0020_number>21</Figure_x0020_number>
</Cast>
<Cast>
<ID>33</ID>
<Identifier>BarL2</Identifier>
<Location>Archives Nationales, Paris</Location>
<Accession_x002F_Collection_x0020_number>Service des Sceaux; SC/Collection Douët d&apos;Arcq 6199</Accession_x002F_Collection_x0020_number>
<Colour_x0020_1>uncoloured</Colour_x0020_1>
<Colour_x0020_2>uncoloured</Colour_x0020_2>
<Material>plaster</Material>
<Surface>plain</Surface>
<Surround>none</Surround>
<Condition_x003A__x0020_fineness>fine</Condition_x003A__x0020_fineness>
<Condition_x003A__x0020_completeness>slight damage to design and legend</Condition_x003A__x0020_completeness>
<Covering>plastic cover</Covering>
<Notes>L. Douët d&apos;Arcq, &apos;La Collection des Sceaux&apos;, vol. 2, p. 441, no. 6199.  Original in Arch. de l&apos;Emp.  L 846.  &apos;Appendu à une confirmation des priviléges de la Saint-Chapelle du Palai, datée de Boissy, 5 des nones de novembre, l&apos;an 1er du pontificat d&apos;Alexandre V (1er novembre 1409).&apos;</Notes>
<MyImage>BarL2AN.jpg</MyImage>
<Width>67</Width>
<Figure_x0020_number>22</Figure_x0020_number>
</Cast>
<Cast>
<ID>35</ID>
<Identifier>Bessarion1</Identifier>
<Location>Archives Nationales, Paris</Location>
<Accession_x002F_Collection_x0020_number>Service des Sceaux; SC/Champagne 1462</Accession_x002F_Collection_x0020_number>
<Colour_x0020_1>uncoloured</Colour_x0020_1>
<Colour_x0020_2>uncoloured</Colour_x0020_2>
<Material>plaster</Material>
<Surface>plain</Surface>
<Surround>none</Surround>
<Condition_x003A__x0020_fineness>faint</Condition_x003A__x0020_fineness>
<Condition_x003A__x0020_completeness>damage to design and legend</Condition_x003A__x0020_completeness>
<Covering>none</Covering>